Sheet: Sheet1
A1: total GB vi trenger: | B1: Leverandør | C1: pris pr. Mnd | E1: usd to nok | F1: euro to nok
A2: 0 | B2: Hetzner | C2: of:=LOOKUP([.A2];[.A16:.A19];[.C16:.C19]) -> 44.577 | E2: 10.36 | F2: 11.7
B3: BorgBase | C3: of:=MIN([.G10:.G12]) -> 20.72
B4: rsync.net | C4: of:=MIN([.E23:.E24]) -> 16.576
A8: BorgBase | B8: https://www.borgbase.com/#pricing
A9: Desc | B9: included | C9: Base $/mo | D9: + $ pr GB
A10: Small | B10: 250 | C10: of:=24/12 -> 2 | D10: 0.01 | E10: of:=MAX(0; [.$A$2] - [.B10]) -> 0 | F10: of:=[.D10]*[.E10]+[.C10] -> 2 | G10: of:=[.F10]*[.$E$2] -> 20.72
A11: Medium | B11: 1000 | C11: of:=80/12 -> 6.66666666666667 | D11: of:=7/1000 -> 0.007 | E11: of:=MAX(0; [.$A$2] - [.B11]) -> 0 | F11: of:=[.D11]*[.E11]+[.C11] -> 6.66666666666667 | G11: of:=[.F11]*[.$E$2] -> 69.0666666666667
A12: Large | B12: 2000 | C12: of:=150/12 -> 12.5 | D12: of:=5/1000 -> 0.005 | E12: of:=MAX(0; [.$A$2] - [.B12]) -> 0 | F12: of:=[.D12]*[.E12]+[.C12] -> 12.5 | G12: of:=[.F12]*[.$E$2] -> 129.5
A14: Hetzner | B14: https://www.hetzner.com/storage/storage-box/
A15: GB steps | B15: price, past step | C15: pris I nok
A16: 0 | B16: 3.81 | C16: of:=[.B16]*[.$F$2] -> 44.577 | D16: BX11 – 1TB
A17: 1000 | B17: 12.97 | C17: of:=[.B17]*[.$F$2] -> 151.749 | D17: BX21 – 5TB
A18: 5000 | B18: 24.57 | C18: of:=[.B18]*[.$F$2] -> 287.469 | D18: BX31 – 10TB
A19: 10000 | B19: 48.31 | C19: of:=[.B19]*[.$F$2] -> 565.227 | D19: BX41 – 20TB
A21: rsync.net | B21: https://www.rsync.net/products/borg.html
A22: minimum | B22: Minimum $ | C22: $/GB/mo
A23: 200 | B23: of:=[.A23]*[.C23] -> 1.6 | C23: 0.008 | D23: of:=IF([.$A$2]>[.A23];[.$A$2]*[.C23];[.B23]) -> 1.6 | E23: of:=[.D23]*[.$E$2] -> 16.576
A25: Backblaze B2 | B25: $/TB/mo | C25: $/GB/mo | D25: nok/TB/mo
B26: 6 | C26: of:=[.B26]/1000 -> 0.006 | D26: of:=[.B26]*[.E2] -> 62.16
A28: GB we have | B28: Backblaze B2 | C28: Hetzner | D28: BorgBase | E28: Rsync.net | F28: Borg small | G28: Borg medium | H28: Borg Large
A29: 1000 | B29: of:=[.A29]*[.C$26]*[.E$2] -> 62.16 | C29: of:=LOOKUP([.A29];[.$A$16:.$A$19];[.$C$16:.$C$19]) -> 151.749 | D29: of:=MIN([.F29:.H29]) -> 69.0666666666667 | E29: of:=IF([.A29]<[.$A$23];[.$B$23];[.A29]*[.$C$23])*[.$E$2] -> 82.88 | F29: of:=IF([.A29]<=[.$B$10];[.$C$10];([.A29]-[.$B$10]+[.A29])*[.$D$10])*[.$E$2] -> 181.3 | G29: of:=IF([.A29]<=[.$B$11];[.$C$11];([.A29]-[.$B$11]+[.A29])*[.$D$11])*[.$E$2] -> 69.0666666666667 | H29: of:=IF([.A29]<=[.$B$12];[.$C$12];([.A29]-[.$B$12]+[.A29])*[.$D$12])*[.$E$2] -> 129.5
A30: 1200 | B30: of:=[.A30]*[.C$26]*[.E$2] -> 74.592 | C30: of:=LOOKUP([.A30];[.$A$16:.$A$19];[.$C$16:.$C$19]) -> 151.749 | D30: of:=MIN([.F30:.H30]) -> 101.528 | E30: of:=IF([.A30]<[.$A$23];[.$B$23];[.A30]*[.$C$23])*[.$E$2] -> 99.456 | F30: of:=IF([.A30]<=[.$B$10];[.$C$10];([.A30]-[.$B$10]+[.A30])*[.$D$10])*[.$E$2] -> 222.74 | G30: of:=IF([.A30]<=[.$B$11];[.$C$11];([.A30]-[.$B$11]+[.A30])*[.$D$11])*[.$E$2] -> 101.528 | H30: of:=IF([.A30]<=[.$B$12];[.$C$12];([.A30]-[.$B$12]+[.A30])*[.$D$12])*[.$E$2] -> 129.5
A31: 1400 | B31: of:=[.A31]*[.C$26]*[.E$2] -> 87.024 | C31: of:=LOOKUP([.A31];[.$A$16:.$A$19];[.$C$16:.$C$19]) -> 151.749 | D31: of:=MIN([.F31:.H31]) -> 129.5 | E31: of:=IF([.A31]<[.$A$23];[.$B$23];[.A31]*[.$C$23])*[.$E$2] -> 116.032 | F31: of:=IF([.A31]<=[.$B$10];[.$C$10];([.A31]-[.$B$10]+[.A31])*[.$D$10])*[.$E$2] -> 264.18 | G31: of:=IF([.A31]<=[.$B$11];[.$C$11];([.A31]-[.$B$11]+[.A31])*[.$D$11])*[.$E$2] -> 130.536 | H31: of:=IF([.A31]<=[.$B$12];[.$C$12];([.A31]-[.$B$12]+[.A31])*[.$D$12])*[.$E$2] -> 129.5
A32: 1600 | B32: of:=[.A32]*[.C$26]*[.E$2] -> 99.456 | C32: of:=LOOKUP([.A32];[.$A$16:.$A$19];[.$C$16:.$C$19]) -> 151.749 | D32: of:=MIN([.F32:.H32]) -> 129.5 | E32: of:=IF([.A32]<[.$A$23];[.$B$23];[.A32]*[.$C$23])*[.$E$2] -> 132.608 | F32: of:=IF([.A32]<=[.$B$10];[.$C$10];([.A32]-[.$B$10]+[.A32])*[.$D$10])*[.$E$2] -> 305.62 | G32: of:=IF([.A32]<=[.$B$11];[.$C$11];([.A32]-[.$B$11]+[.A32])*[.$D$11])*[.$E$2] -> 159.544 | H32: of:=IF([.A32]<=[.$B$12];[.$C$12];([.A32]-[.$B$12]+[.A32])*[.$D$12])*[.$E$2] -> 129.5
A33: 1800 | B33: of:=[.A33]*[.C$26]*[.E$2] -> 111.888 | C33: of:=LOOKUP([.A33];[.$A$16:.$A$19];[.$C$16:.$C$19]) -> 151.749 | D33: of:=MIN([.F33:.H33]) -> 129.5 | E33: of:=IF([.A33]<[.$A$23];[.$B$23];[.A33]*[.$C$23])*[.$E$2] -> 149.184 | F33: of:=IF([.A33]<=[.$B$10];[.$C$10];([.A33]-[.$B$10]+[.A33])*[.$D$10])*[.$E$2] -> 347.06 | G33: of:=IF([.A33]<=[.$B$11];[.$C$11];([.A33]-[.$B$11]+[.A33])*[.$D$11])*[.$E$2] -> 188.552 | H33: of:=IF([.A33]<=[.$B$12];[.$C$12];([.A33]-[.$B$12]+[.A33])*[.$D$12])*[.$E$2] -> 129.5
A34: 2000 | B34: of:=[.A34]*[.C$26]*[.E$2] -> 124.32 | C34: of:=LOOKUP([.A34];[.$A$16:.$A$19];[.$C$16:.$C$19]) -> 151.749 | D34: of:=MIN([.F34:.H34]) -> 129.5 | E34: of:=IF([.A34]<[.$A$23];[.$B$23];[.A34]*[.$C$23])*[.$E$2] -> 165.76 | F34: of:=IF([.A34]<=[.$B$10];[.$C$10];([.A34]-[.$B$10]+[.A34])*[.$D$10])*[.$E$2] -> 388.5 | G34: of:=IF([.A34]<=[.$B$11];[.$C$11];([.A34]-[.$B$11]+[.A34])*[.$D$11])*[.$E$2] -> 217.56 | H34: of:=IF([.A34]<=[.$B$12];[.$C$12];([.A34]-[.$B$12]+[.A34])*[.$D$12])*[.$E$2] -> 129.5
A35: 2200 | B35: of:=[.A35]*[.C$26]*[.E$2] -> 136.752 | C35: of:=LOOKUP([.A35];[.$A$16:.$A$19];[.$C$16:.$C$19]) -> 151.749 | D35: of:=MIN([.F35:.H35]) -> 124.32 | E35: of:=IF([.A35]<[.$A$23];[.$B$23];[.A35]*[.$C$23])*[.$E$2] -> 182.336 | F35: of:=IF([.A35]<=[.$B$10];[.$C$10];([.A35]-[.$B$10]+[.A35])*[.$D$10])*[.$E$2] -> 429.94 | G35: of:=IF([.A35]<=[.$B$11];[.$C$11];([.A35]-[.$B$11]+[.A35])*[.$D$11])*[.$E$2] -> 246.568 | H35: of:=IF([.A35]<=[.$B$12];[.$C$12];([.A35]-[.$B$12]+[.A35])*[.$D$12])*[.$E$2] -> 124.32
A36: 2400 | B36: of:=[.A36]*[.C$26]*[.E$2] -> 149.184 | C36: of:=LOOKUP([.A36];[.$A$16:.$A$19];[.$C$16:.$C$19]) -> 151.749 | D36: of:=MIN([.F36:.H36]) -> 145.04 | E36: of:=IF([.A36]<[.$A$23];[.$B$23];[.A36]*[.$C$23])*[.$E$2] -> 198.912 | F36: of:=IF([.A36]<=[.$B$10];[.$C$10];([.A36]-[.$B$10]+[.A36])*[.$D$10])*[.$E$2] -> 471.38 | G36: of:=IF([.A36]<=[.$B$11];[.$C$11];([.A36]-[.$B$11]+[.A36])*[.$D$11])*[.$E$2] -> 275.576 | H36: of:=IF([.A36]<=[.$B$12];[.$C$12];([.A36]-[.$B$12]+[.A36])*[.$D$12])*[.$E$2] -> 145.04
A37: 2600 | B37: of:=[.A37]*[.C$26]*[.E$2] -> 161.616 | C37: of:=LOOKUP([.A37];[.$A$16:.$A$19];[.$C$16:.$C$19]) -> 151.749 | D37: of:=MIN([.F37:.H37]) -> 165.76 | E37: of:=IF([.A37]<[.$A$23];[.$B$23];[.A37]*[.$C$23])*[.$E$2] -> 215.488 | F37: of:=IF([.A37]<=[.$B$10];[.$C$10];([.A37]-[.$B$10]+[.A37])*[.$D$10])*[.$E$2] -> 512.82 | G37: of:=IF([.A37]<=[.$B$11];[.$C$11];([.A37]-[.$B$11]+[.A37])*[.$D$11])*[.$E$2] -> 304.584 | H37: of:=IF([.A37]<=[.$B$12];[.$C$12];([.A37]-[.$B$12]+[.A37])*[.$D$12])*[.$E$2] -> 165.76
A38: 2800 | B38: of:=[.A38]*[.C$26]*[.E$2] -> 174.048 | C38: of:=LOOKUP([.A38];[.$A$16:.$A$19];[.$C$16:.$C$19]) -> 151.749 | D38: of:=MIN([.F38:.H38]) -> 186.48 | E38: of:=IF([.A38]<[.$A$23];[.$B$23];[.A38]*[.$C$23])*[.$E$2] -> 232.064 | F38: of:=IF([.A38]<=[.$B$10];[.$C$10];([.A38]-[.$B$10]+[.A38])*[.$D$10])*[.$E$2] -> 554.26 | G38: of:=IF([.A38]<=[.$B$11];[.$C$11];([.A38]-[.$B$11]+[.A38])*[.$D$11])*[.$E$2] -> 333.592 | H38: of:=IF([.A38]<=[.$B$12];[.$C$12];([.A38]-[.$B$12]+[.A38])*[.$D$12])*[.$E$2] -> 186.48